[
  {
    "name": "13rianK/japanese-tutor",
    "url": "https://github.com/13rianK/japanese-tutor",
    "description": "Runs daily Japanese lessons with vocabulary, grammar, and graded practice.",
    "category": "Language Learning",
    "marker": null,
    "supported_tools": [
      "claude-code",
      "cursor",
      "copilot"
    ]
  },
  {
    "name": "24kchengYe/human-skill-tree - k12-sciences",
    "url": "https://github.com/24kchengYe/human-skill-tree/tree/master/skills/01-k12-sciences",
    "description": "Tutors K-12 physics, chemistry, and biology through Socratic, inquiry-based questioning.",
    "category": "STEM Subjects",
    "marker": null,
    "supported_tools": [
      "claude-code",
      "cursor",
      "copilot",
      "gemini-cli"
    ]
  },
  {
    "name": "eranw2000/google-slides-skill",
    "url": "https://github.com/eranw2000/google-slides-skill",
    "description": "Redesigns Google Slides decks against branding and visually verifies output.",
    "category": "Google Workspace for Students",
    "marker": null,
    "supported_tools": [
      "claude-code",
      "cursor",
      "copilot"
    ]
  },
  {
    "name": "espindolavinicius/linkedin-growth-skill",
    "url": "https://github.com/espindolavinicius/linkedin-growth-skill",
    "description": "Audits and rewrites LinkedIn profiles into a monthly content calendar.",
    "category": "College Applications & Career",
    "marker": null,
    "supported_tools": [
      "claude-code",
      "cursor",
      "copilot"
    ]
  },
  {
    "name": "lishix520/academic-paper-skills",
    "url": "https://github.com/lishix520/academic-paper-skills",
    "description": "Plans and drafts academic papers through reviewer-simulated quality checkpoints.",
    "category": "Writing & Humanities",
    "marker": null,
    "supported_tools": [
      "claude-code",
      "cursor",
      "copilot"
    ]
  },
  {
    "name": "0xsarwagya/ontoly",
    "url": "https://github.com/0xsarwagya/ontoly",
    "description": "Maps codebases into graph-backed architecture evidence.",
    "category": "Coding & CS Education",
    "marker": null,
    "supported_tools": [
      "claude-code",
      "cursor",
      "copilot"
    ]
  },
  {
    "name": "abelsr/Computational-Physics",
    "url": "https://github.com/abelsr/Computational-Physics",
    "description": "Solves physics problems with Python and Jupyter notebooks, from mechanics to electromagnetism.",
    "category": "STEM Subjects",
    "marker": null,
    "supported_tools": [
      "claude-code",
      "cursor",
      "copilot"
    ]
  },
  {
    "name": "aidankinzett/claude-git-pr-skill",
    "url": "https://github.com/aidankinzett/claude-git-pr-skill",
    "description": "Runs consistent, professional GitHub pull-request reviews with pending reviews and code suggestions.",
    "category": "Coding & CS Education",
    "marker": null,
    "supported_tools": [
      "claude-code",
      "cursor",
      "copilot"
    ]
  },
  {
    "name": "fronkt/Academic-Essay-Reviewer",
    "url": "https://github.com/fronkt/Academic-Essay-Reviewer",
    "description": "Reviews Common App and UC personal statements via a simulated admissions committee.",
    "category": "College Applications & Career",
    "marker": null,
    "supported_tools": [
      "claude-code",
      "cursor",
      "copilot"
    ]
  },
  {
    "name": "AnayDhawan/oss-launch",
    "url": "https://github.com/AnayDhawan/oss-launch",
    "description": "Shipped a side project? Scaffold the OSS launch files (README/LICENSE/CI/launch plan) and use it as application signal.",
    "category": "College Applications & Career",
    "marker": null,
    "supported_tools": [
      "claude-code",
      "cursor",
      "copilot"
    ]
  },
  {
    "name": "anthropics/doc-coauthoring",
    "url": "https://officialskills.sh/anthropics/skills/doc-coauthoring",
    "description": "Collaborative document editing and co-authoring, handy for group IAs or shared EE drafts.",
    "category": "IB & IGCSE Coursework",
    "marker": null,
    "supported_tools": [
      "claude-code",
      "cursor",
      "copilot"
    ]
  },
  {
    "name": "anthropics/docx",
    "url": "https://officialskills.sh/anthropics/skills/docx",
    "description": "Creates and edits Word documents with tracked changes, comments, and formatting.",
    "category": "Study & Productivity",
    "marker": null,
    "supported_tools": [
      "claude-code",
      "cursor",
      "copilot"
    ]
  },
  {
    "name": "anthropics/internal-comms",
    "url": "https://officialskills.sh/anthropics/skills/internal-comms",
    "description": "Writes status reports, newsletters, and FAQs, good for group project updates and lab reports.",
    "category": "Study & Productivity",
    "marker": null,
    "supported_tools": [
      "claude-code",
      "cursor",
      "copilot"
    ]
  },
  {
    "name": "anthropics/pdf",
    "url": "https://officialskills.sh/anthropics/skills/pdf",
    "description": "Extracts text from PDFs, creates new PDFs, and fills forms, useful for working with past papers and mark schemes.",
    "category": "IB & IGCSE Coursework",
    "marker": null,
    "supported_tools": [
      "claude-code",
      "cursor",
      "copilot"
    ]
  },
  {
    "name": "anthropics/web-artifacts-builder",
    "url": "https://officialskills.sh/anthropics/skills/web-artifacts-builder",
    "description": "Builds complex claude.ai HTML artifacts with React and Tailwind, useful for CS project demos and interactive coursework submissions.",
    "category": "Coding & CS Education",
    "marker": null,
    "supported_tools": [
      "claude-code",
      "cursor",
      "copilot"
    ]
  },
  {
    "name": "anthropics/webapp-testing",
    "url": "https://officialskills.sh/anthropics/skills/webapp-testing",
    "description": "Automates browser testing of local web apps with Playwright, handy for verifying CS class projects.",
    "category": "Coding & CS Education",
    "marker": null,
    "supported_tools": [
      "claude-code",
      "cursor",
      "copilot"
    ]
  },
  {
    "name": "anthropics/xlsx",
    "url": "https://officialskills.sh/anthropics/skills/xlsx",
    "description": "Creates and analyzes spreadsheets with formulas, charts, and data cleaning.",
    "category": "Study & Productivity",
    "marker": null,
    "supported_tools": [
      "claude-code",
      "cursor",
      "copilot"
    ]
  },
  {
    "name": "basicmachines-co/basic-memory - memory-literary-analysis",
    "url": "https://github.com/basicmachines-co/basic-memory/tree/main/skills/memory-literary-analysis",
    "description": "Analyzes literary works into a searchable knowledge graph.",
    "category": "Writing & Humanities",
    "marker": null,
    "supported_tools": [
      "claude-code",
      "cursor",
      "copilot"
    ]
  },
  {
    "name": "bevibing/tutor-skills",
    "url": "https://github.com/bevibing/tutor-skills",
    "description": "Turns PDFs, docs, or codebases into Obsidian study vaults with interactive quizzes.",
    "category": "Study & Productivity",
    "marker": null,
    "supported_tools": [
      "claude-code",
      "cursor",
      "copilot"
    ]
  },
  {
    "name": "borghei/Claude-Skills - research/grants",
    "url": "https://github.com/borghei/Claude-Skills/tree/main/research/grants",
    "description": "Structures a scholarship or grant proposal around fit, narrative, and budget instead of boilerplate.",
    "category": "College Applications & Career",
    "marker": null,
    "supported_tools": [
      "claude-code",
      "cursor",
      "copilot"
    ]
  },
  {
    "name": "chrisvoncsefalvay/claude-d3js-skill",
    "url": "https://github.com/chrisvoncsefalvay/claude-d3js-skill",
    "description": "Builds interactive D3.js charts, graphs, and network diagrams for data analysis and reports.",
    "category": "STEM Subjects",
    "marker": null,
    "supported_tools": [
      "claude-code",
      "cursor",
      "copilot"
    ]
  },
  {
    "name": "ComposioHQ/awesome-claude-skills - artifacts-builder",
    "url": "https://github.com/ComposioHQ/awesome-claude-skills/tree/master/artifacts-builder",
    "description": "Builds multi-component React/Tailwind HTML artifacts for interactive demos and projects.",
    "category": "Coding & CS Education",
    "marker": null,
    "supported_tools": [
      "claude-code",
      "cursor",
      "copilot"
    ]
  },
  {
    "name": "ComposioHQ/awesome-claude-skills - content-research-writer",
    "url": "https://github.com/ComposioHQ/awesome-claude-skills/tree/master/content-research-writer",
    "description": "Researches sources, improves hooks, iterates on outlines, and adds citations to essays and articles.",
    "category": "Writing & Humanities",
    "marker": null,
    "supported_tools": [
      "claude-code",
      "cursor",
      "copilot"
    ]
  },
  {
    "name": "ComposioHQ/awesome-claude-skills - developer-growth-analysis",
    "url": "https://github.com/ComposioHQ/awesome-claude-skills/tree/master/developer-growth-analysis",
    "description": "Analyzes your Claude Code chat history to surface coding patterns and learning gaps.",
    "category": "Coding & CS Education",
    "marker": null,
    "supported_tools": [
      "claude-code",
      "cursor",
      "copilot"
    ]
  },
  {
    "name": "anthropics/pptx",
    "url": "https://officialskills.sh/anthropics/skills/pptx",
    "description": "Creates, edits, and reads PowerPoint slide decks and templates.",
    "category": "Study & Productivity",
    "marker": null,
    "supported_tools": [
      "claude-code",
      "cursor",
      "copilot"
    ]
  },
  {
    "name": "ComposioHQ/awesome-claude-skills - domain-name-brainstormer",
    "url": "https://github.com/ComposioHQ/awesome-claude-skills/tree/master/domain-name-brainstormer",
    "description": "Generates domain name ideas and checks availability across TLDs for side projects.",
    "category": "College Applications & Career",